{
  "schemaVersion": "1.0",
  "caseId": "case_demo_20260812",
  "generatedAt": "2026-08-12T00:00:00Z",
  "filters": {
    "edgeTypes": ["duplicate_text", "later_copy_candidate"],
    "minEvidenceCount": 2,
    "from": "2026-08-01T00:00:00Z",
    "to": "2026-08-12T00:00:00Z"
  },
  "nodes": [
    {
      "accountId": "acct_alpha",
      "handle": "alpha",
      "observedPostCount": 12
    },
    {
      "accountId": "acct_beta",
      "handle": "beta",
      "observedPostCount": 9
    }
  ],
  "edges": [
    {
      "edgeId": "edge_alpha_beta_later_copy",
      "sourceAccountId": "acct_alpha",
      "targetAccountId": "acct_beta",
      "edgeType": "later_copy_candidate",
      "weight": 3,
      "evidenceCount": 3,
      "firstObservedAt": "2026-08-10T00:00:00Z",
      "lastObservedAt": "2026-08-11T00:00:00Z"
    }
  ],
  "page": {
    "nextCursor": null
  }
}
